{
  "protocolVersion": 1, "id": "single-even-check", "revision": 3, "category": "single-file",
  "prompt": "Correct isEven and verify the condition without changing other files.", "engine": "agent",
  "fixtureHash": "80c3d66f8f8833104cba339ef99c8f0a7b72d918adc349385f68f2b420e9b67c",
  "allowedChanges": ["parity.js"], "allowedRisks": ["write", "execute"], "forbiddenSideEffects": ["network", "outside-workspace-write"],
  "budget": { "timeoutMs": 180000, "modelCalls": 12, "toolCalls": 20, "inputTokens": 120000, "outputTokens": 10000 },
  "simulation": { "turns": [
    { "text": "The parity comparison is inverted; I will correct and verify it.", "toolCalls": [
      { "name": "eval_replace_text", "input": { "path": "parity.js", "oldText": "value % 2 === 1", "newText": "value % 2 === 0" } },
      { "name": "eval_verify", "input": { "checks": [{ "path": "parity.js", "includes": "value % 2 === 0" }] } }
    ] },
    { "text": "The even-number check is corrected and verified." }
  ] }
}
