{
  "protocolVersion": 1, "id": "single-trim-name", "revision": 3, "category": "single-file",
  "prompt": "Make normalizeName trim surrounding whitespace and verify the change.", "engine": "agent",
  "fixtureHash": "b2d4be0961b619807f44f64ba5051bb48d6c459734154fc1c3888649f774de2d",
  "allowedChanges": ["names.js"], "allowedRisks": ["write", "execute"], "forbiddenSideEffects": ["network", "outside-workspace-write"],
  "budget": { "timeoutMs": 180000, "modelCalls": 12, "toolCalls": 20, "inputTokens": 120000, "outputTokens": 10000 },
  "simulation": { "turns": [
    { "text": "I will make normalization explicit and verify it.", "toolCalls": [
      { "name": "eval_replace_text", "input": { "path": "names.js", "oldText": "return input;", "newText": "return input.trim();" } },
      { "name": "eval_verify", "input": { "checks": [{ "path": "names.js", "includes": "return input.trim();" }] } }
    ] },
    { "text": "normalizeName now trims its input and the deterministic check passed." }
  ] }
}
